"id","nome","nome_ptbr","tipo","subtipo","raridade","descricao"
2234,"Staff of Flowers","Cajado of Flowers","arma","cajado","Comum","[PLACEHOLDER] This wooden staff has 10 charges. While holding it, you can take a Magic action to expend 1 charge from the staff and cause a flower to sprout from a patch of earth or soil within 5 feet of yourself, or from the staff itself. Unless you choose a specific kind of flower, the staff creates a mild-scented daisy. The flower is harmless and nonmagical, and it grows or withers as a normal flower would. The staff regains 1d6 + 4 expended charges daily at dawn. If you expend the last charge, roll 1d2..."
2411,"Wand of Conducting","Varinha of Conducting","arma","varinha","Comum","[PLACEHOLDER] This wand has 3 charges. While holding it, you can take a Magic action to expend 1 charge and create orchestral music by waving it around. The music can be heard out to 120 feet and ends when you stop waving the wand. The wand regains all expended charges daily at dawn. If you expend the wand's last charge, roll 1d20. On a 1, a sad tuba sound plays as the wand crumbles into dust and is destroyed."
2432,"Wand of Pyrotechnics","Varinha of Pyrotechnics","arma","varinha","Comum","[PLACEHOLDER] This wand has 7 charges. While holding it, you can take a Magic action to expend 1 charge and create a harmless burst of multicolored light at a point you can see up to 120 feet away. The burst of light is accompanied by a crackling noise that can be heard up to 300 feet away. The light is as bright as a torch flame but lasts only a second. The wand regains 1d6 + 1 expended charges daily at dawn. If you expend the wand's last charge, roll 1d20. On a 1, the wand erupts in a harmless pyrotechni..."
2434,"Wand of Scowls","Varinha of Scowls","arma","varinha","Comum","[PLACEHOLDER] This wand has 3 charges. While holding it, you can use an action to expend 1 of its charges and target a humanoid you can see within 30 feet of you. The target must succeed on a 10 Charisma saving throw or be forced to scowl for 1 minute. The wand regains all expended charges daily at dawn. If you expend the wand's last charge, roll a d20. On a 1, the wand transforms into a wand of smiles."
2437,"Wand of Smiles","Varinha of Smiles","arma","varinha","Comum","[PLACEHOLDER] This wand has 3 charges. While holding it, you can use an action to expend 1 of its charges and target a humanoid you can see within 30 feet of you. The target must succeed on a 10 Charisma saving throw or be forced to smile for 1 minute. The wand regains all expended charges daily at dawn. If you expend the wand's last charge, roll a d20. On a 1, the wand transforms into a wand of scowls."
3895,"Staff of Minor Curses","Cajado of Minor Curses","arma","cajado","Comum","[PLACEHOLDER] This twisted, wooden staff has 10 charges. While holding it, you can use an action to inflict a minor curse on a creature you can see within 30 feet of you. The target must succeed on a DC 10 Constitution saving throw or be affected by the chosen curse. A minor curse causes a non-debilitating effect or change in the creature, such as an outbreak of boils on one section of the target's skin, intermittent hiccupping, transforming the target's ears into small, donkey-like ears, or similar effect..."
484,"+1 Wand of the War Mage","+1 Varinha of the War Mage","arma","varinha","Incomum","[PLACEHOLDER] While you are holding this wand, you gain a +1 bonus to spell attack rolls. In addition, you ignore Cover when making a spell attack."
680,"Blood Spear","Blood Lança","arma","lanca","Incomum","[PLACEHOLDER] Kavan was a ruthless chieftain whose tribe lived in the Balinok Mountains centuries before the arrival of Strahd von Zarovich. Although he was very much alive, Kavan had some traits in common with vampires: he slept during the day and hunted at night, he drank the blood of his prey, and he lived underground. In battle, he wielded a spear stained with blood. His was the first blood spear, a weapon that drains life from those it kills and transfers that life to its wielder, imbuing that individ..."
760,"Candle Mace","Candle Maça","arma","maca","Incomum","[PLACEHOLDER] You have a +1 bonus to attack and damage rolls made with this magic weapon. The head of this mace sheds bright light in a 5-foot-radius and dim light for an additional 5 feet. When you wield this mace, you can extinguish or ignite its light as an action."
924,"Crusader's Shortsword","Crusader's Espada Curta","arma","espada","Incomum","[PLACEHOLDER] The Crusader's Shortsword is a sentient lawful good +1 shortsword (Intelligence 11, Wisdom 13, Charisma 13). It has hearing and normal vision out to a range of 120 feet. It communicates by transmitting emotion to the creature carrying or wielding it. The sword's purpose is to fight evil. The sword has the following additional properties: The sword continually sheds bright light in a 15-foot radius and dim light for an additional 15 feet. Only by destroying the sword can this light be extingui..."
946,"Dagger of Guitar Solos","Adaga of Guitar Solos","arma","adaga","Incomum","[PLACEHOLDER] This drow-made dagger is decorated with silver web filigree. It magically plays a fragment of a guitar solo when struck or used to strike a foe."
1001,"Draconic Longsword","Draconic Espada Longa","arma","espada","Incomum","[PLACEHOLDER] This longsword has a dragon-shaped hilt. While you carry it, you gain the ability to speak and understand the Draconic language."
1002,"Dragon Sensing Longsword","Dragon Sensing Espada Longa","arma","espada","Incomum","[PLACEHOLDER] This +1 longsword is made of dragon bone and with a dragon-leather grip. It has rubies in its pommel and hilt. The sword grows warm and the rubies glow slightly when the sword is within 120 feet of a dragon."
1072,"Enspelled Staff (Cantrip)","Enspelled Cajado (Cantrip)","arma","cajado","Incomum","[PLACEHOLDER] Bound into this staff is a cantrip. The cantrip is determined when the staff is created and can be of any school of magic. The staff has 6 charges and regains 1d6 expended charges daily at dawn. While holding the staff, you can expend 1 charge to cast its spell. If you expend the staff's last charge, roll 1d20. On a 1, the staff loses its properties and becomes a nonmagical Quarterstaff. The spell's saving throw DC is 13, and its attack bonus is 5."
1073,"Enspelled Staff (Level 1)","Enspelled Cajado (Level 1)","arma","cajado","Incomum","[PLACEHOLDER] Bound into this staff is a level 1 spell. The spell is determined when the staff is created and can be of any school of magic. The staff has 6 charges and regains 1d6 expended charges daily at dawn. While holding the staff, you can expend 1 charge to cast its spell. If you expend the staff's last charge, roll 1d20. On a 1, the staff loses its properties and becomes a nonmagical Quarterstaff. The spell's saving throw DC is 13, and its attack bonus is 5."
1148,"Flame Tongue Shortsword of Greed","Flame Tongue Espada Curta of Greed","arma","espada","Incomum","[PLACEHOLDER] You can use a bonus action to speak this magic sword's command word, causing flames to erupt from the blade. These flames shed bright light in a 40-foot radius and dim light for an additional 40 feet. While the sword is ablaze, it deals an extra 2d6 fire damage to any target it hits. The flames last until you use a bonus action to speak the command word again or until you drop or sheathe the sword. While you are attuned to this sword you can use an action to mentally command it to detect gems..."
1412,"Jade Serpent Staff","Jade Serpent Cajado","arma","cajado","Incomum","[PLACEHOLDER] This staff is broken into five pieces, each worth 100 gp for the jade alone. The entire staff can be restored with mending cantrips; each casting of the spell repairs one break in the staff. If the staff is made whole, it transforms from an object into an animated jade serpent that has the statistics of a giant poisonous snake, with these changes: The serpent is a construct that understands and obeys whoever was holding the staff when it transformed. It has immunity to poison damage and the p..."
1414,"Javelin of Lightning","Dardo of Lightning","arma","lanca","Incomum","[PLACEHOLDER] This javelin is a magic weapon. When you hurl it and speak its command word, it transforms into a bolt of lightning, forming a line 5 feet wide that extends out from you to a target within 120 feet. Each creature in the line excluding you and the target must make a 13 Dexterity saving throw, taking 4d6 lightning damage on a failed save, and half as much damage on a successful one. The lightning bolt turns back into a javelin when it reaches the target. Make a ranged weapon attack against the ..."
1421,"Junky +1 Dagger","Junky +1 Adaga","arma","adaga","Incomum","[PLACEHOLDER] You have a +1 bonus to attack and damage rolls made with this dagger, which looks like junk. When it is used, its grip frays, its blade chips, and it flakes rust. If you get a natural 1 on an attack roll while wielding this weapon, it breaks and becomes nonmagical."
2137,"Skyblinder Staff","Skyblinder Cajado","arma","cajado","Incomum","[PLACEHOLDER] You gain a +1 bonus to attack and damage rolls made with this magic quarterstaff. While holding it, you gain a +1 bonus to spell attack rolls. If a flying creature you can see within 30 feet of you makes an attack roll against you, you can use your reaction to hold the staff aloft and cause it to flare with light. The attacker has disadvantage on the attack roll, and it must succeed on a 15 Constitution saving throw or be blinded until the start of its next turn."
2247,"Staff of the Adder","Cajado of the Adder","arma","cajado","Incomum","[PLACEHOLDER] You can use a bonus action to speak this staff's command word and make the head of the staff become that of an animate poisonous snake for 1 minute. By using another bonus action to speak the command word again, you return the staff to its normal inanimate form. You can make a melee attack using the snake head, which has a reach of 5 feet. Your proficiency bonus applies to the attack roll. On a hit, the target takes 1d6 piercing damage and must succeed on a 15 Constitution saving throw or tak..."
2253,"Staff of the Python","Cajado of the Python","arma","cajado","Incomum","[PLACEHOLDER] You can use an action to speak this staff's command word and throw the staff on the ground within 10 feet of you. The staff becomes a giant constrictor snake under your control and acts on its own initiative count. By using a bonus action to speak the command word again, you return the staff to its normal form in a space formerly occupied by the snake. On your turn, you can mentally command the snake if it is within 60 feet of you and you aren't incapacitated. You decide what action the snake..."
2371,"Trident of Fish Command","Tridente of Fish Command","arma","lanca","Incomum","[PLACEHOLDER] This trident is a magic weapon. It has 3 charges. While you carry it, you can use an action and expend 1 charge to cast dominate beast (save 15) from it on a beast that has an innate swimming speed. The trident regains 1d3 expended charges daily at dawn."
2415,"Wand of Entangle","Varinha of Entangle","arma","varinha","Incomum","[PLACEHOLDER] This wand has 7 charges. While holding it, you can use an action to expend 1 of its charges to cast the entangle spell (save 13) from it. The wand regains 1d6 + 1 expended charges daily at dawn. If you expend the wand's last charge, roll a d20. On a 1, the wand crumbles into ashes and is destroyed."
2422,"Wand of Magic Detection","Varinha of Magic Detection","arma","varinha","Incomum","[PLACEHOLDER] This wand has 3 charges. While holding it, you can expend 1 charge as an action to cast the detect magic spell from it. The wand regains 1d3 expended charges daily at dawn."
2424,"Wand of Magic Missiles","Varinha of Magic Missiles","arma","varinha","Incomum","[PLACEHOLDER] This wand has 7 charges. While holding it, you can use an action to expend 1 or more of its charges to cast the magic missile spell from it. For 1 charge, you cast the 1st-level version of the spell. You can increase the spell slot level by one for each additional charge you expend. The wand regains 1d6 + 1 expended charges daily at dawn. If you expend the wand's last charge, roll a d20. On a 1, the wand crumbles into ashes and is destroyed."
2435,"Wand of Secrets","Varinha of Secrets","arma","varinha","Incomum","[PLACEHOLDER] The wand has 3 charges. While holding it, you can use an action to expend 1 of its charges, and if a secret door or trap is within 30 feet of you, the wand pulses and points at the one nearest to you. The wand regains 1d3 expended charges daily at dawn."
2439,"Wand of Web","Varinha of Web","arma","varinha","Incomum","[PLACEHOLDER] This wand has 7 charges. While holding it, you can use an action to expend 1 of its charges to cast the web spell (save 15) from it. The wand regains 1d6 + 1 expended charges daily at dawn. If you expend the wand's last charge, roll a d20. On a 1, the wand crumbles into ashes and is destroyed."
2550,"Anointing Mace","Anointing Maça","arma","exotica","Incomum","[PLACEHOLDER] Also called an anointing gada, you gain a +1 bonus to attack and damage rolls made with this magic weapon. In addition, the ornately decorated head of the mace holds a reservoir perforated with small holes. As an action, you can fill the reservoir with a single potion or vial of liquid, such as holy water or alchemist's fire. You can press a button on the haft of the weapon as a bonus action, which opens the holes. If you hit a target with the weapon while the holes are open, the weapon deals..."
2869,"Clockwork Mace of Divinity","Clockwork Maça of Divinity","arma","exotica","Incomum","[PLACEHOLDER] This clockwork mace is composed of several different metals. While attuned to this magic weapon, you have proficiency with it. As a bonus action, you can command the mace to transform into a trident. When you hit with an attack using this weapon's trident form, the target takes an extra 1d6 radiant damage."
3097,"Gale Javelin","Gale Dardo","arma","lanca","Incomum","[PLACEHOLDER] The metallic head of this javelin is embellished with three small wings. When you speak a command word while making a ranged weapon attack with this magic weapon, a swirling vortex of wind follows its path through the air. Draw a line between you and the target of your attack; each creature within 10 feet of this line must make a DC 13 Strength saving throw. On a failed save, the creature is pushed backward 10 feet and falls prone. In addition, if this ranged weapon attack hits, the target mu..."
3199,"Heartbreak's Dagger","Heartbreak's Adaga","arma","adaga","Incomum","[PLACEHOLDER] This delicate dagger, not much larger than a hatpin, features a curling silver cross-piece and a hilt wrapped in soft red leather. You gain a +1 to _attack and damage rolls_  with this weapon. On a critical hit, the target must make a Constitution _saving throw_  versus your maneuver DC. On a failure, it begins to bleed heavily, taking an additional 2d4 damage at the start of each of its turns. It can make another Constitution saving throw at the end of each of its turns, ending the effect on..."
3274,"Javelin of Teleportation","Dardo of Teleportation","arma","lanca","Incomum","[PLACEHOLDER] This short-hafted javelin bears a long, metal head. You gain a +1 bonus to attack and damage rolls made with this magic weapon. When you hit a creature with this weapon, you can speak its command word and force the target to make a DC 13 Wisdom saving throw. On a failed save, the target is teleported to an unoccupied space you can see within 60 feet of you. That space must be on the ground or on a floor.   The javelin’s property can’t be used again until the next dawn. In the meantime, the ja..."
3485,"Pestilent Spear","Pestilent Lança","arma","lanca","Incomum","[PLACEHOLDER] The head of this spear is deadly sharp, despite the rust and slimy residue on it that always accumulate no matter how well it is cleaned. When you hit a creature with this magic weapon, it must succeed on a DC 13 Constitution saving throw or contract the sewer plague disease."
3842,"Soldra's Staff","Soldra's Cajado","arma","cajado","Incomum","[PLACEHOLDER] Crafted by a skilled wizard and meant to be a spellcaster's last defense, this staff is 5 feet long, made of yew wood that curves at its top, is iron shod at its mid-section, and capped with a silver dragon's claw that holds a lustrous, though rough and uneven, black pearl. When you make an attack with this staff, it howls and whistles hauntingly like the wind. When you cast a spell from this staff, it chirps like insects on a hot summer night. This staff can be wielded as a magic quarterstaf..."
3873,"Splinter Staff","Splinter Cajado","arma","cajado","Incomum","[PLACEHOLDER] This roughly made staff has cracked and splintered ends and can be wielded as a magic quarterstaff. When you roll a 20 on an attack roll made with this weapon, you embed a splinter in the target's body, and the pain and discomfort of the splinter is distracting. While the splinter remains embedded, the target has disadvantage on Dexterity, Intelligence, and Wisdom checks, and, if it is concentrating on a spell, it must succeed on a DC 10 Constitution saving throw at the start of each of its t..."
3877,"Staff of Channeling","Cajado of Channeling","arma","cajado","Incomum","[PLACEHOLDER] This plain, wooden staff has 5 charges and regains 1d4 + 1 expended charges daily at dawn. When you cast a spell while holding this staff, you can expend 1 or more of its charges as part of the casting to increase the level of the spell. Expending 1 charge increases the spell's level by 1, expending 3 charges increases the spell's level by 2, and expending 5 charges increases the spell's level by 3. When you increase a spell's level using the staff, the spell casts as if you used a spell slot..."
3911,"Staff of the Lantern Bearer","Cajado of the Lantern Bearer","arma","cajado","Incomum","[PLACEHOLDER] An iron hook is affixed to the top of this plain, wooden staff. While holding this staff, you can use an action to cast the light spell from it at will, but the light can emanate only from the staff 's hook. If a lantern hangs from the staff 's hook, you gain the following benefits while holding the staff: - You can control the light of the lantern, lighting or extinguishing it as a bonus action. The lantern must still have oil, if it requires oil to produce a flame. - The lantern's flame can..."
3919,"Staff of the Unhatched","Cajado of the Unhatched","arma","cajado","Incomum","[PLACEHOLDER] This staff carved from a burnt ash tree is topped with an unhatched dragon’s (see Creature Codex) skull. This staff can be wielded as a magic quarterstaff. The staff has 5 charges for the following properties. It regains 1d4 + 1 expended charges daily at dusk. If you expend the last charge, roll a d20. On a 1, the staff crumbles to dust and is destroyed. Necrotic Strike. When you hit with a melee attack using the staff, you can expend 1 charge to deal an extra 1d8 necrotic damage to the targe..."
3962,"Sword of Fallen Saints","Espada de Fallen Saints","arma","espada","Incomum","[PLACEHOLDER] This enchanted blade is infused with the spirits of fallen warriors who carried it in battle long ago. You gain a +1 bonus to attack and damage rolls made with this magic weapon. If you die while attuned to the sword, you gain the effect of the gentle repose spell. This effect lasts until another creature attunes to the sword."
1078,"Enspelled Staff (Level 6)","Enspelled Cajado (Level 6)","arma","cajado","Lendario","[PLACEHOLDER] Bound into this staff is a level 6 spell. The spell is determined when the staff is created and can be of any school of magic. The staff has 6 charges and regains 1d6 expended charges daily at dawn. While holding the staff, you can expend 1 charge to cast its spell. If you expend the staff's last charge, roll 1d20. On a 1, the staff loses its properties and becomes a nonmagical Quarterstaff. The spell's saving throw DC is 17, and its attack bonus is 9."
1079,"Enspelled Staff (Level 7)","Enspelled Cajado (Level 7)","arma","cajado","Lendario","[PLACEHOLDER] Bound into this staff is a level 7 spell. The spell is determined when the staff is created and can be of any school of magic. The staff has 6 charges and regains 1d6 expended charges daily at dawn. While holding the staff, you can expend 1 charge to cast its spell. If you expend the staff's last charge, roll 1d20. On a 1, the staff loses its properties and becomes a nonmagical Quarterstaff. The spell's saving throw DC is 18, and its attack bonus is 10."
1080,"Enspelled Staff (Level 8)","Enspelled Cajado (Level 8)","arma","cajado","Lendario","[PLACEHOLDER] Bound into this staff is a level 8 spell. The spell is determined when the staff is created and can be of any school of magic. The staff has 6 charges and regains 1d6 expended charges daily at dawn. While holding the staff, you can expend 1 charge to cast its spell. If you expend the staff's last charge, roll 1d20. On a 1, the staff loses its properties and becomes a nonmagical Quarterstaff. The spell's saving throw DC is 18, and its attack bonus is 10."
1147,"Flail of Tiamat","Mangual of Tiamat","arma","maca","Lendario","[PLACEHOLDER] This magic flail is made in the image of Tiamat, with five jagged heads shaped like the heads of five different chromatic dragons. You gain a +3 bonus to attack and damage rolls made with this flail. When you hit with an attack roll using it, the target takes an extra 5d4 damage of your choice of one of the following damage types: acid, cold, fire, lightning, or poison. While holding the flail, you can use an action and speak a command word to cause the heads to breathe multicolored flames in..."
1289,"Hither-Thither Staff","Hither-Thither Cajado","arma","cajado","Lendario","[PLACEHOLDER] This walking stick has a brilliant gemstone fitted at the top. This staff has 4 charges and regains 1d4 expended charges daily at dawn. As an action, you can expend 1 charge from the staff to create two linked teleportation portals, each one appearing on a flat surface of your choice that you can see within 1,500 feet of yourself. Alternatively, you can expend 1 charge as an action to relocate one or both portals, subject to the same limitation. The surface on which a portal appears must be b..."
1462,"Longbow of the Healing Hearth","Arco Longo of the Healing Hearth","arma","arco","Lendario","[PLACEHOLDER] This ivory longbow is inscribed with a prayer to the god Hiatea, the runes of which are entwined with gilded engravings of wheat stalks and deer antlers. You gain a +3 bonus to attack and damage rolls made with this weapon. If you load no ammunition in the weapon, it produces its own, automatically creating one magic arrow when you pull back the string. The arrow created by the bow vanishes the instant after it hits or misses a target. The bow has 8 charges for the following properties, which..."
2251,"Staff of the Magi","Cajado of the Magi","arma","cajado","Lendario","[PLACEHOLDER] This staff can be wielded as a magic quarterstaff that grants a +2 bonus to attack and damage rolls made with it. While you hold it, you gain a +2 bonus to spell attack rolls. The staff has 50 charges for the following properties. It regains 4d6 + 2 expended charges daily at dawn. If you expend the last charge, roll a d20. On a 20, the staff regains 1d12 + 1 charges. While holding the staff, you have advantage on saving throws against spells. In addition, you can use your reaction when anothe..."
2292,"Sword of Answering","Espada de Answering","arma","espada","Lendario","[PLACEHOLDER] You gain a +3 bonus to attack rolls and damage rolls made with this sword. In addition, while you hold the sword, you can take a Reaction to make one melee attack with it against any creature in your reach that deals damage to you. You have Advantage on the attack roll, and any damage dealt with this special attack ignores any Immunity or Resistance the target has to that damage."
2293,"Sword of Answering (Answerer)","Espada de Answering (Answerer)","arma","espada","Lendario","[PLACEHOLDER] In the world of Greyhawk, only nine of these blades are known to exist. Each is patterned after the legendary sword Fragarach, which is variously translated as ""Final Word."" Each of the nine swords has its own name and alignment, and each bears a different gem in its pommel. Answerer, the Chaotic Good sword, has an emerald set in its pommel. You gain a +3 bonus to attack and damage rolls made with this sword. In addition, while you hold the sword, you can use your reaction to make one melee a..."
2294,"Sword of Answering (Back Talker)","Espada de Answering (Back Talker)","arma","espada","Lendario","[PLACEHOLDER] In the world of Greyhawk, only nine of these blades are known to exist. Each is patterned after the legendary sword Fragarach, which is variously translated as ""Final Word."" Each of the nine swords has its own name and alignment, and each bears a different gem in its pommel. Back Talker, the Chaotic Evil sword, has jet set in its pommel. You gain a +3 bonus to attack and damage rolls made with this sword. In addition, while you hold the sword, you can use your reaction to make one melee attac..."
