"id","nome","nome_ptbr","tipo","subtipo","raridade","descricao"
554,"Amulet of the Planes","Amuleto of the Planes","acessorio","amuleto","Muito Raro","[PLACEHOLDER] While wearing this amulet, you can use an action to name a location that you are familiar with on another plane of existence. Then make a 15 Intelligence check. On a successful check, you cast the plane shift spell. On a failure, you and each creature and object within 15 feet of you travel to a random destination. Roll a d100. On a 1-60, you travel to a random location on the plane you named. On a 61-100, you travel to a randomly determined plane of existence."
645,"Belt of Fire Giant Strength","Cinturão of Fire Giant Strength","acessorio","cinturao","Muito Raro","[PLACEHOLDER] While wearing this belt, your Strength score changes to 25. The item has no effect on you if your Strength without the belt is equal to or greater than the belt's score."
647,"Belt of Frost Giant Strength","Cinturão of Frost Giant Strength","acessorio","cinturao","Muito Raro","[PLACEHOLDER] While wearing this belt, your Strength score changes to 23. The item has no effect on you if your Strength without the belt is equal to or greater than the belt's score."
651,"Belt of Stone Giant Strength","Cinturão of Stone Giant Strength","acessorio","cinturao","Muito Raro","[PLACEHOLDER] While wearing this belt, your Strength score changes to 23. The item has no effect on you if your Strength without the belt is equal to or greater than the belt's score."
769,"Cape of Enlargement","Capa de Enlargement","acessorio","capa","Muito Raro","[PLACEHOLDER] Ancient runes are stitched in silver thread along the hem of this grayish-purple cape. The cape has 3 charges. As a bonus action while wearing the cape, you can expend 1 of its charges to enlarge yourself, granting yourself the following benefits: Your size increases by one category—from Medium to Large, for example. If there isn't enough room for your size to increase by one category, you instead become the maximum possible size in the space available. You have advantage on Strength checks a..."
816,"Cloak of Arachnida","Capa of Arachnida","acessorio","capa","Muito Raro","[PLACEHOLDER] This fine garment is made of black silk interwoven with faint silvery threads. While wearing it, you gain the following benefits: You have resistance to poison damage. You have a climbing speed equal to your walking speed. You can move up, down, and across vertical surfaces and upside down along ceilings, while leaving your hands free. You can't be caught in webs of any sort and can move through webs as if they were difficult terrain. You can use an action to cast the web spell (save 13). The..."
873,"Crown of Whirling Comets","Coroa of Whirling Comets","acessorio","elmo","Muito Raro","[PLACEHOLDER] This delicate silver tiara is decorated with stellar iconography. While you wear the crown, the gems on the tiara's points detach and closely orbit your head. The crown has 6 charges for the following properties, which you can use while wearing the crown: The crown regains 1d6 expended charges daily at dawn."
1158,"Flying Citadel Helm","Flying Citadel Elmo","acessorio","elmo","Muito Raro","[PLACEHOLDER] The function of this ornate chair is to propel and maneuver a flying citadel on which it has been installed. The chair has AC 15, 18 hit points, and immunity to poison and psychic damage. It is destroyed if reduced to 0 hit points. The sensation of being attuned to a flying citadel helm is akin to the pins-and-needles effect one experiences after one's arm or leg falls asleep, but not as intense. While attuned to a flying citadel helm and sitting in it, you gain the following abilities for as..."
1248,"Hat of Many Spells","Chapéu of Many Spells","acessorio","foco_arcano","Muito Raro","[PLACEHOLDER] This pointed hat has the following properties. While holding the hat, you can use it as a Spellcasting Focus for your Wizard spells. Any spell you cast using the hat gains a special Somatic component: you must reach into the hat and ""pull"" the spell out of it. While holding the hat, you can try to cast a level 1+ spell you don't know. The spell must be on the Wizard spell list, it must be of a level you can cast, and it can't have Material components costing more than 1,000 GP. Once you decid..."
1267,"Helm of Devil Command","Elmo of Devil Command","acessorio","elmo","Muito Raro","[PLACEHOLDER] This bulky, eyeless helmet is made for a pit fiend but magically resizes to fit the heads of other wearers. While wearing the helm, you can see out of it as though you weren't wearing it. In addition, you know the exact location and type of all devils within 1,000 feet of you. You can telepathically communicate with a devil within range, or you can broadcast your thoughts to all devils within range. The devils receiving your broadcasted thoughts have no special means of replying to them. The ..."
1312,"Horned Ring","Horned Anel","acessorio","anel","Muito Raro","[PLACEHOLDER] Allows an attuned wearer to ignore Undermountain's magical restrictions (see ""Alterations to Magic"")."
1328,"Illusionist's Bracers","Illusionist's Braçadeiras","acessorio","bracadeira","Muito Raro","[PLACEHOLDER] A powerful illusionist of House Dimir originally developed these bracers, which enabled her to create multiple minor illusions at once. The bracers' power, though, extends far beyond illusions. While wearing the bracers, whenever you cast a cantrip, you can use a bonus action on the same turn to cast that cantrip a second time."
1483,"Maddgoth's Helm","Maddgoth's Elmo","acessorio","elmo","Muito Raro","[PLACEHOLDER] While you wear this helm and are inside Maddgoth's castle, on its roof, or in its courtyard, you have immunity to all damage. If the helm is taken from the castle, it turns to dust and is destroyed."
1552,"Mindguard Crown","Mindguard Coroa","acessorio","elmo","Muito Raro","[PLACEHOLDER] While you wear this adamantine crown, you have advantage on Intelligence, Wisdom, and Charisma saving throws, and you have resistance to psychic damage."
1660,"Peregrine Mask","Peregrine Máscara","acessorio","elmo","Muito Raro","[PLACEHOLDER] While wearing this winged helm, you have a flying speed of 60 feet. In addition, you have advantage on initiative rolls."
1885,"Ring of Amity","Anel of Amity","acessorio","anel","Muito Raro","[PLACEHOLDER] This ring is carved from hematite and bears an engraving of the friend rune. When you first attune to this ring, you can touch one willing creature and form a magical bond between the two of you. While this bond lasts, whenever you are subjected to a spell or magical effect that restores hit points, the bonded creature also receives the benefits of the spell or effect. You can bond with a different creature whenever you finish a long rest, provided that you can touch the creature and the crea..."
1890,"Ring of Collecting","Anel of Collecting","acessorio","anel","Muito Raro","[PLACEHOLDER] While wearing this ring you can use it to cast the Leomund's Tiny Hut spell as an action. Once this property is used, it can't be used again until the next dawn. Additionally, as a bonus action, you can use the ring to disintegrate any nonmagical piece of art (drawing, painting, or sculpture) within 60 feet that is no larger than Medium-sized. That art now appears inside the tiny hut, for you to appreciate whenever you desire. If you try to remove this art from the tiny hut, it vanishes forev..."
1929,"Ring of Red Fury","Anel of Red Fury","acessorio","anel","Muito Raro","[PLACEHOLDER] This ring has a stripe of ruidium running through it. While wearing the ring, you gain the following benefits: You can breathe water. You gain a swimming speed equal to your walking speed. As a bonus action, you can use the ring to gain the following benefits, which last for 1 minute or until you are incapacitated: You can't use this property of the ring again until you finish a long rest. When you use the Ruidium Rage property of the ring, you must make a 20 Charisma saving throw. On a faile..."
1930,"Ring of Regeneration","Anel of Regeneration","acessorio","anel","Muito Raro","[PLACEHOLDER] While wearing this ring, you regain 1d6 hit points every 10 minutes, provided that you have at least 1 hit point. If you lose a body part, the ring causes the missing part to regrow and return to full functionality after 1d6 + 1 days if you have at least 1 hit point the whole time."
1932,"Ring of Shooting Stars","Anel of Shooting Stars","acessorio","anel","Muito Raro","[PLACEHOLDER] While wearing this ring in dim light or darkness, you can cast dancing lights and light from the ring at will. Casting either spell from the ring requires an action. The ring has 6 charges for the following other properties. The ring regains 1d6 expended charges daily at dawn. You can expend 1 charge as an action to cast faerie fire from the ring. You can expend 2 charges as an action to create one to four 3-foot-diameter spheres of lightning. The more spheres you create, the less powerful ea..."
1940,"Ring of Telekinesis","Anel of Telekinesis","acessorio","anel","Muito Raro","[PLACEHOLDER] While wearing this ring, you can cast the telekinesis spell at will, but you can target only objects that aren't being worn or carried."
1951,"Ring of Treachery","Anel of Treachery","acessorio","anel","Muito Raro","[PLACEHOLDER] This ring has 3 charges. While wearing this ring, when you're damaged, you may use a reaction to expend a charge and transfer that damage to a random creature (which could include an ally) within 60 feet. All charges are restored when you finish a long rest."
1965,"Robe of Scintillating Colors","Manto of Scintillating Colors","acessorio","capa","Muito Raro","[PLACEHOLDER] This robe has 3 charges, and it regains 1d3 expended charges daily at dawn. While you wear it, you can use an action and expend 1 charge to cause the garment to display a shifting pattern of dazzling hues until the end of your next turn. During this time, the robe sheds bright light in a 30-foot radius and dim light for an additional 30 feet. Creatures that can see you have disadvantage on attack rolls against you. In addition, any creature in the bright light that can see you when the robe's..."
1968,"Robe of Stars","Manto of Stars","acessorio","capa","Muito Raro","[PLACEHOLDER] This black or dark blue robe is embroidered with small white or silver stars. You gain a +1 bonus to saving throws while you wear it. Six stars, located on the robe's upper front portion, are particularly large. While wearing this robe, you can use an action to pull off one of the stars and use it to cast magic missile as a 5th-level spell. Daily at dusk, 1d6 removed stars reappear on the robe. While you wear the robe, you can use an action to enter the Astral Plane along with everything you ..."
1977,"Rod of Absorption","Bastão of Absorption","acessorio","cajado","Muito Raro","[PLACEHOLDER] While holding this rod, you can use your reaction to absorb a spell that is targeting only you and not with an area of effect. The absorbed spell's effect is canceled, and the spell's energy—not the spell itself—is stored in the rod. The energy has the same level as the spell when it was cast. The rod can absorb and store up to 50 levels of energy over the course of its existence. Once the rod absorbs 50 levels of energy, it can't absorb more. If you are targeted by a spell that the rod can't..."
1979,"Rod of Alertness","Bastão of Alertness","acessorio","cajado","Muito Raro","[PLACEHOLDER] This rod has a flanged head and the following properties. While holding the rod, you have advantage on Wisdom (Perception) checks and on rolls for initiative. While holding the rod, you can use an action to cast one of the following spells from it: detect evil and good, detect magic, detect poison and disease, or see invisibility. As an action, you can plant the haft end of the rod in the ground, whereupon the rod's head sheds bright light in a 60-foot radius and dim light for an additional 6..."
1981,"Rod of Hellish Flames","Bastão of Hellish Flames","acessorio","cajado","Muito Raro","[PLACEHOLDER] Glowing cinders orbit the flanged head of this black iron rod. This rod can be used as an arcane focus. While holding this rod, you gain the following benefits:"
1989,"Rod of Security","Bastão of Security","acessorio","cajado","Muito Raro","[PLACEHOLDER] While holding this rod, you can use an action to activate it. The rod then instantly transports you and up to 199 other willing creatures you can see to a paradise that exists in an extraplanar space. You choose the form that the paradise takes. It could be a tranquil garden, lovely glade, cheery tavern, immense palace, tropical island, fantastic carnival, or whatever else you can imagine. Regardless of its nature, the paradise contains enough water and food to sustain its visitors. Everythin..."
2030,"Sanctum Amulet","Sanctum Amuleto","acessorio","amuleto","Muito Raro","[PLACEHOLDER] A black opal pendant hangs at the base of this pearlescent chain. The sacred rune is inscribed on the back of the pendant. While wearing this item, you have resistance to necrotic damage. Additionally, you can cast the spare the dying cantrip using either an action or a bonus action. When a creature you can see within 60 feet of you is reduced to 0 hit points as a result of taking damage, you can use your reaction to invoke the item's rune, causing the pendant to flash with pale light. The cr..."
2135,"Skull Helm","Skull Elmo","acessorio","elmo","Muito Raro","[PLACEHOLDER] While wearing this skull-shaped helm, you have resistance to cold, poison, and necrotic damage. Additionally, while wearing the helm, you can cast Spirit of Death from it without requiring material components. Once you use the helm to cast the spell, the helm can't cast this spell again until the next dawn."
2449,"Watchful Helm","Watchful Elmo","acessorio","elmo","Muito Raro","[PLACEHOLDER] While you wear this helm, you gain a +1 bonus to AC and remain aware of your surroundings even while you're asleep, and you have advantage on Wisdom (Perception) checks that rely on sight. As a bonus action, you can cast the see invisibility spell from the helm. Once this property of the helm is used, it can't be used again until the next dawn."
2496,"Wyrmreaver Gauntlets","Wyrmreaver Manoplas","acessorio","luvas","Muito Raro","[PLACEHOLDER] Originally crafted for ground-bound giant brawlers to fight against dragons and other enormous predators of the sky, these studded gauntlets are engraved with the dragon rune. While you are wearing these gauntlets, your unarmed strike deals an additional 1d6 force damage on a hit. Additionally, whenever you finish a long rest, choose one of the following damage types: acid, cold, fire, lightning, or poison. You have resistance to the chosen damage type until you finish another long rest. As a..."
2724,"Boots of Quaking","Botas of Quaking","acessorio","botas","Muito Raro","[PLACEHOLDER] While wearing these steel-toed boots, the earth itself shakes when you walk, causing harmless, but unsettling, tremors. If you move at least 15 feet in a single turn, all creatures within 10 feet of you at any point during your movement must make a DC 16 Strength saving throw or take 1d6 force damage and fall prone. In addition, while wearing these boots, you can cast earthquake, requiring no concentration, by speaking a command word and jumping on a point on the ground. The spell is centered..."
3088,"Freerunner Rod","Freerunner Bastão","acessorio","cajado","Muito Raro","[PLACEHOLDER] Tightly intertwined lengths of grass, bound by additional stiff, knotted blades of grass, form this rod, which is favored by plains-dwelling druids and rangers. While holding it and in grasslands, you leave behind no tracks or other traces of your passing, and you can pass through nonmagical plants without being slowed by them and without taking damage from them if they have thorns, spines, or a similar hazard. In addition, beasts with an Intelligence of 3 or lower that are native to grasslan..."
3096,"Fulminar Bracers","Fulminar Braçadeiras","acessorio","luvas","Muito Raro","[PLACEHOLDER] Stylized etchings of cat-like lightning elementals known as Fulminars (see Creature Codex) cover the outer surfaces of these solid silver bracers. While wearing these bracers, lightning crackles harmless down your hands, and you have resistance to lightning damage and thunder damage. The bracers have 3 charges. You can use an action to expend 1 charge to create lightning shackles that bind up to two creatures you can see within 60 feet of you. Each target must make a DC 15 Dexterity saving th..."
3139,"Gloves of the Walking Shade","Luvas of the Walking Shade","acessorio","luvas","Muito Raro","[PLACEHOLDER] Each glove is actually comprised of three, black ivory rings (typically fitting the thumb, middle finger, and pinkie) which are connected to each other. The rings are then connected to an intricately-engraved onyx wrist cuff by a web of fine platinum chains and tiny diamonds. While wearing these gloves, you gain the following benefits: - You have resistance to necrotic damage. - You can spend one Hit Die during a short rest to remove one level of exhaustion instead of regaining hit points. - ..."
3141,"Goblin Mask","Goblin Máscara","acessorio","elmo","Muito Raro","[PLACEHOLDER] Your vision shifts into a sickly yellow tint. Your muscles tense up and contract inside you, made twitchy as new sensory information floods your brain. You gain the following benefits and powers while wearing the _goblin mask_: _Darkvision_. You can see in dim light within 60 feet of you as if it were bright light, and in darkness as if it were dim light. _Goblin Tongue_. You can speak, read, and write Goblin as a language. _Nimble Escape._ This mask has 5 charges. While wearing it, you can u..."
3156,"Grasping Cloak","Grasping Capa","acessorio","capa","Muito Raro","[PLACEHOLDER] Made of strips of black leather, this cloak always shines as if freshly oiled. The strips writhe and grasp at nearby creatures. While wearing this cloak, you can use a bonus action to command the strips to grapple a creature no more than one size larger than you within 5 feet of you. The strips make the grapple attack roll with a +7 bonus. On a hit, the target is grappled by the cloak, leaving your hands free to perform other tasks or actions that require both hands. However, you are still co..."
3282,"Kraken Clutch Ring","Kraken Clutch Anel","acessorio","anel","Muito Raro","[PLACEHOLDER] This green copper ring is etched with the image of a kraken with splayed tentacles. The ring has 5 charges, and it regains 1d4 + 1 expended charges daily at dawn, as long as it was immersed in water for at least 1 hour since the previous dawn. If the ring has at least 1 charge, you have advantage on grapple checks. While wearing this ring, you can expend 1 or more of its charges to cast one of the following spells from it, using spell save DC 15: black tentacles (2 charges), call lightning (1..."
3302,"Lightning Rod","Lightning Bastão","acessorio","cajado","Muito Raro","[PLACEHOLDER] This rod is made from the blackened wood of a lightning-struck tree and topped with a spike of twisted iron. It functions as a magic javelin that grants a +1 bonus to attack and damage rolls made with it. While holding it, you are immune to lightning damage, and each creature within 5 feet of you has resistance to lightning damage. The rod can hold up to 6 charges, but it has 0 charges when you first attune to it. Whenever you are subjected to lightning damage, the rod gains 1 charge. While t..."
3363,"Mask of Relentless Fury","Máscara of Relentless Fury","acessorio","elmo","Muito Raro","[PLACEHOLDER] This cracked marble mask bears a toothy, unsettling grin. It perfectly fits over its wearer’s face, and though it lacks eyeholes an attuned wearer can see through it without issue. While wearing this mask, you can’t be _blinded_ , _charmed_ , or _frightened_ , and you are immune to any effect that could be avoided by averting your eyes, such as a _medusa’s_ _Petrifying Gaze_. Insight checks against you are made with _disadvantage_ . Using a bonus action, you can enter a fury that makes you fa..."
3370,"Mayhem Mask","Mayhem Máscara","acessorio","elmo","Muito Raro","[PLACEHOLDER] This goat mask with long, curving horns is carved from dark wood and framed in goat's hair. While wearing this mask, you can use its horns to make unarmed strikes. When you hit with it, your horns deal piercing damage equal to 1d6 + your Strength modifier, instead of bludgeoning damage normal for an unarmed strike. If you moved at least 15 feet straight toward the target before you attacked with the horns, the attack deals piercing damage equal to 2d6 + your Strength modifier instead. In addi..."
3588,"Red Cloak of Riding","Red Capa of Riding","acessorio","capa","Muito Raro","[PLACEHOLDER] While wearing this scarlet cloak, you gain a +2 bonus to AC but have _disadvantage_  on Insight and Perception checks. In addition, when you are reduced to 0 hit points and wearing this cloak, you drop to 1 hit point instead. You can’t use this feature again until you finish a _long rest_ ."
3637,"Ring of Sealing","Anel of Sealing","acessorio","anel","Muito Raro","[PLACEHOLDER] This ring appears to be made of golden chain links. It has 3 charges and regains 1d3 expended charges daily at dawn. When you hit a creature with a melee attack while wearing this ring, you can use a bonus action and expend 1 of the ring's charges to cause mystical golden chains to spring from the ground and wrap around the creature. The target must make a DC 17 Wisdom saving throw. On a failure, the magical chains hold the target firmly in place, and it is restrained. The target can't move o..."
3690,"Rod of Entropy","Bastão of Entropy","acessorio","cajado","Muito Raro","[PLACEHOLDER] This skull-topped rod can be used as a club that grants a +1 bonus to _attack and damage rolls_  and deals an extra 1d6 necrotic damage. The rod has 3 charges and regains 1d3 expended charges at dawn. As an action, you can expend the rod’s charges, increasing entropy in a 15-foot cone. Each creature in the area makes a DC 15 Constitution _saving throw_ . On a failure, the target takes 3d8 necrotic damage per charge expended, or half the damage on a success. A creature killed by this damage de..."
3701,"Rod of Sanguine Mastery","Bastão of Sanguine Mastery","acessorio","cajado","Muito Raro","[PLACEHOLDER] This rod is topped with a red ram's skull with two backswept horns. As an action, you can spend one or more Hit Dice, up to half of your maximum Hit Dice. For each Hit Die spent in this way, you roll the die and add your Constitution modifier to it. You lose hit points equal to the total, and a target within 60 feet of you must make a DC 17 Dexterity saving throw, taking necrotic damage equal to the total on a failed save, or half as much damage on a successful one. You can't use this feature..."
3706,"Rod of the Infernal Realms","Bastão of the Infernal Realms","acessorio","cajado","Muito Raro","[PLACEHOLDER] The withered, clawed hand of a demon or devil tops this iron rod. While holding this rod, you gain a +2 bonus to spell attack rolls, and the save DC for your spells increases by 2. Frightful Eyes. While holding this rod, you can use a bonus action to cause your eyes to glow with infernal fire for 1 minute. While your eyes are glowing, a creature that starts its turn or enters a space within 10 feet of you must succeed on a Wisdom saving throw against your spell save DC or become frightened of..."
4019,"Transforming Cloak","Transforming Capa","acessorio","capa","Muito Raro","[PLACEHOLDER] While you are attuned to and wearing a _transforming cloak_, you gain _resistance_  to a type of damage and you can use an action to activate an elemental form that lasts for 1 hour, until you fall _unconscious_ , or you use a bonus action to end it. Once you have used the cloak to take on an elemental form, you cannot use that property again until you have finished a long rest. The resistance you gain and the type of your elemental form is listed on Table: Transforming Cloaks. _Gnome Cloak._..."
4073,"Wand of Accompaniment","Varinha of Accompaniment","acessorio","varinha","Muito Raro","[PLACEHOLDER] Tiny musical notes have been etched into the sides of this otherwise plain, wooden wand. It has 7 charges for the following properties. It regains 1d6 + 1 expended charges daily at dawn. If you expend the wand's last charge, roll a d20. On a 1, the wand disintegrates with a small bang. Dance. While holding the wand, you can use an action to expend 3 charges to cast the irresistible dance spell (save DC 17) from it. If the target is in the area of the Song property of this wand, it has disadva..."
4081,"Wand of Drowning","Varinha of Drowning","acessorio","varinha","Muito Raro","[PLACEHOLDER] This wand appears to be carved from the bones of a large fish, which have been cemented together. The wand has 3 charges and regains 1d3 expended charges daily at dawn. While holding this wand, you can use an action to expend 1 charge to cause a thin stream of seawater to spray toward a creature you can see within 60 feet of you. If the target can breathe only air, it must succeed on a DC 15 Constitution saving throw or its lungs fill with rancid seawater and it begins drowning. A drowning cr..."
4119,"Wand of the War Mage +3","Varinha of the War Mage +3","acessorio","varinha","Muito Raro","[PLACEHOLDER] You must be a spellcaster to attune to this wand. While holding this wand, you gain a bonus to _spell attack rolls_  (very rare +3), and you ignore _half cover_  when making spell attacks."
